{
  "$schema": "http://json-schema.org/draft-07/schema#",
  "$id": "https://spas.io/schemas/runtime-metadata-v1.schema.json",
  "title": "SPAS Runtime Metadata",
  "description": "Schema for SPAS runtime service metadata - Repository output with design-time metadata enriched with runtime deployment fields",
  "type": "object",
  "required": ["schemaVersion", "id", "name", "version", "boundedContext"],
  "properties": {
    "schemaVersion": {
      "type": "string",
      "const": "runtime-metadata-v1",
      "description": "Schema version identifier for runtime metadata"
    },
    "id": {
      "type": "string",      "pattern": "^[a-z0-9]+(-[a-z0-9]+)*$",      "description": "Unique service identifier (kebab-case recommended)"
    },
    "name": {
      "type": "string",
      "description": "Human-readable service name"
    },
    "description": {
      "type": "string",
      "description": "Service description"
    },
    "version": {
      "type": "string",
      "pattern": "^\\d+\\.\\d+\\.\\d+(-[a-zA-Z0-9.-]+)?$",
      "description": "Service version (semver)"
    },
    "boundedContext": {
      "type": "string",
      "description": "Domain bounded context (e.g., Payments, Orders)"
    },
    "capabilities": {
      "type": "array",
      "items": {
        "type": "string"
      },
      "description": "List of service capabilities"
    },
    "commands": {
      "type": "array",
      "items": {
        "type": "object",
        "required": ["name"],
        "properties": {
          "name": {
            "type": "string",
            "pattern": "^[a-z0-9]+(-[a-z0-9]+)*$",
            "description": "Canonical command identifier (kebab-case)"
          },
          "version": {
            "type": "string",
            "description": "Command contract version (semver recommended)"
          },
          "produces": {
            "type": "array",
            "items": {
              "type": "object",
              "required": ["type", "version", "when"],
              "properties": {
                "type": {
                  "type": "string",
                  "description": "Produced event type; must match an entry in events[].type"
                },
                "version": {
                  "type": "string",
                  "description": "Produced event version; must match the referenced event's version"
                },
                "when": {
                  "const": "success",
                  "description": "For PoC, only 'success' is supported"
                }
              }
            },
            "description": "Events this command produces when it succeeds"
          }
        }
      },
      "description": "Canonical commands and their produced event relationships"
    },
    "endpoints": {
      "type": "array",
      "items": {
        "type": "object",
        "required": ["name", "type", "protocol", "methodPath", "version", "schemaRef"],
        "properties": {
          "name": {
            "type": "string",
            "description": "Endpoint name"
          },
          "type": {
            "type": "string",
            "enum": ["Command", "Query"],
            "description": "Endpoint type: Command (write) or Query (read)"
          },
          "protocol": {
            "type": "string",
            "enum": ["Http", "Grpc"],
            "description": "Communication protocol"
          },
          "methodPath": {
            "type": "string",
            "description": "HTTP method and path (e.g., POST /api/orders) or gRPC method"
          },
          "version": {
            "type": "string",
            "description": "Endpoint version"
          },
          "schemaRef": {
            "type": "string",
            "format": "uri-reference",
            "description": "Relative or absolute URI reference to endpoint schema (e.g., schemas/create-order.schema.json)"
          },
          "description": {
            "type": "string",
            "description": "Optional plain-text description of the endpoint's purpose and behavior"
          }
        }
      },
      "description": "Service endpoints (commands and queries)"
    },
    "events": {
      "type": "array",
      "items": {
        "type": "object",
        "required": ["type", "version", "schemaRef"],
        "properties": {
          "type": {
            "type": "string",
            "description": "Event type identifier (e.g., OrderCreated)"
          },
          "version": {
            "type": "string",
            "description": "Event schema version"
          },
          "schemaRef": {
            "type": "string",
            "format": "uri-reference",
            "description": "Relative or absolute URI reference to event schema"
          },
          "description": {
            "type": "string",
            "description": "Optional plain-text description of the event's purpose and when it is emitted"
          }
        }
      },
      "description": "Events published by this service (outbound only)"
    },
    "consistency": {
      "type": "object",
      "properties": {
        "commands": {
          "type": "string",
          "enum": ["ACID", "EVENTUAL"],
          "description": "Consistency guarantee for command endpoints"
        },
        "queries": {
          "type": "string",
          "enum": ["STRONG", "EVENTUAL"],
          "description": "Consistency guarantee for query endpoints"
        }
      },
      "description": "Consistency guarantees"
    },
    "network": {
      "type": "object",
      "properties": {
        "requiredEgress": {
          "type": "array",
          "items": {
            "type": "string"
          },
          "description": "Required outbound network dependencies (hostnames or service IDs)"
        }
      },
      "description": "Network requirements"
    },
    "security": {
      "type": "object",
      "required": ["dataClassification"],
      "properties": {
        "authentication": {
          "type": "object",
          "properties": {
            "type": {
              "type": "string",
              "enum": ["OAuth2", "JWT", "ApiKey", "mTLS", "None"],
              "description": "Authentication mechanism"
            },
            "requiredScopes": {
              "type": "array",
              "items": {
                "type": "string"
              },
              "description": "Required OAuth2/OIDC scopes"
            }
          },
          "description": "Authentication configuration (optional)"
        },
        "dataClassification": {
          "type": "array",
          "items": {
            "type": "string",
            "enum": ["public", "internal", "confidential", "restricted"]
          },
          "minItems": 1,
          "description": "Data classification levels handled by this service"
        }
      },
      "description": "Security metadata"
    },
    "license": {
      "type": "string",
      "description": "License identifier (e.g., MIT, Apache-2.0)"
    },
    "runtime": {
      "type": "object",
      "description": "Runtime deployment metadata - added by Repository at publish time",
      "properties": {
        "image": {
          "type": "string",
          "description": "Full OCI image reference with digest (e.g., ghcr.io/org/service@sha256:abc123...)",
          "pattern": "^[a-zA-Z0-9][a-zA-Z0-9._/-]*@sha256:[a-fA-F0-9]{64}$"
        },
        "repository": {
          "type": "string",
          "description": "OCI image repository (e.g., ghcr.io/org/service)",
          "pattern": "^[a-zA-Z0-9][a-zA-Z0-9._/-]*$"
        },
        "tag": {
          "type": "string",
          "description": "Image tag (e.g., 1.0.0, latest)"
        },
        "digest": {
          "type": "string",
          "description": "SHA256 digest of the container image (e.g., sha256:abc123...)",
          "pattern": "^sha256:[a-fA-F0-9]{64}$"
        },
        "resources": {
          "type": "object",
          "description": "Resource requirements (optional)",
          "properties": {
            "cpu": {
              "type": "string",
              "description": "CPU requirement (e.g., 100m, 2)",
              "pattern": "^\\d+m?$"
            },
            "memory": {
              "type": "string",
              "description": "Memory requirement (e.g., 128Mi, 2Gi)",
              "pattern": "^\\d+(Mi|Gi|M|G)$"
            }
          }
        },
        "env": {
          "type": "array",
          "items": {
            "type": "string"
          },
          "description": "Environment variable names required (values not stored for security)"
        }
      }
    },
    "publishedAt": {
      "type": "string",
      "format": "date-time",
      "description": "ISO 8601 timestamp when the service was published to the repository"
    }
  }
}
